{
  "$schema": "https://json-schema.org/draft/2020-12/schema",
  "$id": "https://raw.githubusercontent.com/sinwanjs/sinwan-ui-registry/main/registry-item.schema.json",
  "title": "sinwan-ui registry item",
  "description": "Shape of `public/r/<name>.json`, generated by `sinwan-ui build`. Mirrors `RegistryItem` and `isRegistryItem` in `sinwan-ui/src/registry/schema.ts`.",
  "type": "object",
  "properties": {
    "$schema": {
      "type": "string"
    },
    "name": {
      "description": "Item name used by `sinwan-ui add`, e.g. `button`, `utils`, `use-mobile`.",
      "type": "string",
      "minLength": 1
    },
    "type": {
      "$ref": "#/$defs/registryItemType"
    },
    "title": {
      "type": "string"
    },
    "description": {
      "type": "string"
    },
    "dependencies": {
      "description": "npm specifiers with a version range, e.g. `sinwan-ui-core@^1.0.0`, `echarts@^6.1.0`. `sinwan` is a peer of the app and never listed.",
      "$ref": "#/$defs/stringList"
    },
    "devDependencies": {
      "description": "npm specifiers installed as dev dependencies.",
      "$ref": "#/$defs/stringList"
    },
    "registryDependencies": {
      "description": "Other items this item needs: a bare name (same registry), `@namespace/name` (a registry configured in `sinwan-ui.json`), or a full URL.",
      "$ref": "#/$defs/stringList"
    },
    "files": {
      "type": "array",
      "items": { "$ref": "#/$defs/registryFile" }
    },
    "cssVars": {
      "$ref": "#/$defs/cssVars"
    },
    "docs": {
      "description": "Notes printed after the item is added.",
      "type": "string"
    }
  },
  "required": [
    "name",
    "type",
    "description",
    "dependencies",
    "devDependencies",
    "registryDependencies",
    "files"
  ],
  "$defs": {
    "registryItemType": {
      "enum": [
        "registry:ui",
        "registry:lib",
        "registry:hook",
        "registry:style",
        "registry:block",
        "registry:file"
      ]
    },
    "stringList": {
      "type": "array",
      "items": { "type": "string" }
    },
    "cssVars": {
      "description": "CSS custom properties per scope, e.g. `{ \"light\": { \"primary\": \"oklch(...)\" }, \"dark\": { ... } }`.",
      "type": "object",
      "additionalProperties": {
        "type": "object",
        "additionalProperties": { "type": "string" }
      }
    },
    "registryFile": {
      "type": "object",
      "properties": {
        "path": {
          "description": "Path relative to the consumer alias directory for `type`, e.g. `button.tsx` or `select/select.tsx`.",
          "type": "string",
          "minLength": 1
        },
        "type": {
          "$ref": "#/$defs/registryItemType"
        },
        "content": {
          "description": "Full file source, with cross-item imports in canonical alias form (`@/components/ui/<x>`, `@/lib/utils`, `@/hooks/<x>`).",
          "type": "string"
        },
        "target": {
          "description": "Explicit project-relative destination. Required for `registry:file`.",
          "type": "string"
        }
      },
      "required": ["path", "type", "content"],
      "if": {
        "properties": { "type": { "const": "registry:file" } }
      },
      "then": {
        "required": ["target"]
      }
    }
  }
}
