{
  "$schema": "https://raw.githubusercontent.com/sinwanjs/sinwan-ui-registry/main/registry-item.schema.json",
  "name": "card",
  "type": "registry:ui",
  "title": "Card",
  "description": "Surface with header, content and footer sections.",
  "dependencies": [],
  "devDependencies": [],
  "registryDependencies": [
    "utils"
  ],
  "files": [
    {
      "path": "card.tsx",
      "type": "registry:ui",
      "content": "import { cn } from \"@/lib/utils\";\n\nfunction Card({\n  class: className,\n  size = \"default\",\n  ...props\n}: JSX.IntrinsicElements[\"div\"] & { size?: \"default\" | \"sm\" }) {\n  return (\n    <div\n      data-slot=\"card\"\n      data-size={size}\n      class={cn(\n        \"group/card flex flex-col gap-(--card-spacing) overflow-hidden rounded-xl bg-card py-(--card-spacing) text-sm text-card-foreground ring-1 ring-foreground/10 [--card-spacing:--spacing(4)] has-data-[slot=card-footer]:pb-0 has-[>img:first-child]:pt-0 data-[size=sm]:[--card-spacing:--spacing(3)] data-[size=sm]:has-data-[slot=card-footer]:pb-0 *:[img:first-child]:rounded-t-xl *:[img:last-child]:rounded-b-xl\",\n        className,\n      )}\n      {...props}\n    />\n  );\n}\n\nfunction CardHeader({\n  class: className,\n  ...props\n}: JSX.IntrinsicElements[\"div\"]) {\n  return (\n    <div\n      data-slot=\"card-header\"\n      class={cn(\n        \"group/card-header @container/card-header grid auto-rows-min items-start gap-1 rounded-t-xl px-(--card-spacing) has-data-[slot=card-action]:grid-cols-[1fr_auto] has-data-[slot=card-description]:grid-rows-[auto_auto] [.border-b]:pb-(--card-spacing)\",\n        className,\n      )}\n      {...props}\n    />\n  );\n}\n\nfunction CardTitle({\n  class: className,\n  ...props\n}: JSX.IntrinsicElements[\"div\"]) {\n  return (\n    <div\n      data-slot=\"card-title\"\n      class={cn(\n        \"font-heading text-base leading-snug font-medium group-data-[size=sm]/card:text-sm\",\n        className,\n      )}\n      {...props}\n    />\n  );\n}\n\nfunction CardDescription({\n  class: className,\n  ...props\n}: JSX.IntrinsicElements[\"div\"]) {\n  return (\n    <div\n      data-slot=\"card-description\"\n      class={cn(\"text-sm text-muted-foreground\", className)}\n      {...props}\n    />\n  );\n}\n\nfunction CardAction({\n  class: className,\n  ...props\n}: JSX.IntrinsicElements[\"div\"]) {\n  return (\n    <div\n      data-slot=\"card-action\"\n      class={cn(\n        \"col-start-2 row-span-2 row-start-1 self-start justify-self-end\",\n        className,\n      )}\n      {...props}\n    />\n  );\n}\n\nfunction CardContent({\n  class: className,\n  ...props\n}: JSX.IntrinsicElements[\"div\"]) {\n  return (\n    <div\n      data-slot=\"card-content\"\n      class={cn(\"px-(--card-spacing)\", className)}\n      {...props}\n    />\n  );\n}\n\nfunction CardFooter({\n  class: className,\n  ...props\n}: JSX.IntrinsicElements[\"div\"]) {\n  return (\n    <div\n      data-slot=\"card-footer\"\n      class={cn(\n        \"flex items-center rounded-b-xl border-t bg-muted/50 p-(--card-spacing)\",\n        className,\n      )}\n      {...props}\n    />\n  );\n}\n\nexport {\n  Card,\n  CardAction,\n  CardContent,\n  CardDescription,\n  CardFooter,\n  CardHeader,\n  CardTitle,\n};\n"
    }
  ]
}
