{
  "$schema": "https://raw.githubusercontent.com/sinwanjs/sinwan-ui-registry/main/registry-item.schema.json",
  "name": "utils",
  "type": "registry:lib",
  "title": "Utils",
  "description": "Class name helper combining clsx and tailwind-merge.",
  "dependencies": [
    "clsx@^2.1.1",
    "tailwind-merge@^3.7.0"
  ],
  "devDependencies": [],
  "registryDependencies": [],
  "files": [
    {
      "path": "utils.ts",
      "type": "registry:lib",
      "content": "import { clsx, type ClassValue } from \"clsx\";\nimport { twMerge } from \"tailwind-merge\";\n\n/** @sinwan-pure */\nexport function cn(...inputs: ClassValue[]): string {\n  return twMerge(clsx(inputs));\n}\n"
    }
  ]
}
