{
  "$schema": "https://raw.githubusercontent.com/sinwanjs/sinwan-ui-registry/main/registry-item.schema.json",
  "name": "item",
  "type": "registry:ui",
  "title": "Item",
  "description": "List item layout with media, content and actions.",
  "dependencies": [
    "class-variance-authority@^0.7.1",
    "sinwan-ui-core@^1.0.0"
  ],
  "devDependencies": [],
  "registryDependencies": [
    "separator",
    "utils"
  ],
  "files": [
    {
      "path": "item.tsx",
      "type": "registry:ui",
      "content": "import { cva, type VariantProps } from \"class-variance-authority\";\n\nimport { Slot } from \"sinwan-ui-core/slot\";\nimport { cn } from \"@/lib/utils\";\n\nimport { Separator, type SeparatorProps } from \"@/components/ui/separator\";\n\nfunction ItemGroup({\n  class: className,\n  ...props\n}: JSX.IntrinsicElements[\"div\"]) {\n  return (\n    <div\n      role=\"list\"\n      data-slot=\"item-group\"\n      class={cn(\n        \"group/item-group flex w-full flex-col gap-4 has-data-[size=sm]:gap-2.5 has-data-[size=xs]:gap-2\",\n        className,\n      )}\n      {...props}\n    />\n  );\n}\n\nfunction ItemSeparator({\n  class: className,\n  ...props\n}: SeparatorProps) {\n  return (\n    <Separator\n      data-slot=\"item-separator\"\n      orientation=\"horizontal\"\n      class={cn(\"my-2\", className)}\n      {...props}\n    />\n  );\n}\n\nconst itemVariants = cva(\n  \"group/item flex w-full flex-wrap items-center rounded-lg border text-sm transition-colors duration-100 outline-none focus-visible:border-ring focus-visible:ring-[3px] focus-visible:ring-ring/50 [a]:transition-colors [a]:hover:bg-muted\",\n  {\n    variants: {\n      variant: {\n        default: \"border-transparent\",\n        outline: \"border-border\",\n        muted: \"border-transparent bg-muted/50\",\n      },\n      size: {\n        default: \"gap-2.5 px-3 py-2.5\",\n        sm: \"gap-2.5 px-3 py-2.5\",\n        xs: \"gap-2 px-2.5 py-2 in-data-[slot=dropdown-menu-content]:p-0\",\n      },\n    },\n    defaultVariants: {\n      variant: \"default\",\n      size: \"default\",\n    },\n  },\n);\n\nfunction Item({\n  class: className,\n  variant = \"default\",\n  size = \"default\",\n  asChild = false,\n  ...props\n}: JSX.IntrinsicElements[\"div\"] &\n  VariantProps<typeof itemVariants> & { asChild?: boolean }) {\n  const shared = {\n    \"data-slot\": \"item\",\n    \"data-variant\": variant,\n    \"data-size\": size,\n    class: cn(itemVariants({ variant, size, className })),\n    ...props,\n  };\n\n  if (asChild) {\n    return <Slot {...shared} />;\n  }\n\n  return <div {...shared} />;\n}\n\nconst itemMediaVariants = cva(\n  \"flex shrink-0 items-center justify-center gap-2 group-has-data-[slot=item-description]/item:translate-y-0.5 group-has-data-[slot=item-description]/item:self-start [&_svg]:pointer-events-none\",\n  {\n    variants: {\n      variant: {\n        default: \"bg-transparent\",\n        icon: \"[&_svg:not([class*='size-'])]:size-4\",\n        image:\n          \"size-10 overflow-hidden rounded-sm group-data-[size=sm]/item:size-8 group-data-[size=xs]/item:size-6 [&_img]:size-full [&_img]:object-cover\",\n      },\n    },\n    defaultVariants: {\n      variant: \"default\",\n    },\n  },\n);\n\nfunction ItemMedia({\n  class: className,\n  variant = \"default\",\n  ...props\n}: JSX.IntrinsicElements[\"div\"] & VariantProps<typeof itemMediaVariants>) {\n  return (\n    <div\n      data-slot=\"item-media\"\n      data-variant={variant}\n      class={cn(itemMediaVariants({ variant, className }))}\n      {...props}\n    />\n  );\n}\n\nfunction ItemContent({\n  class: className,\n  ...props\n}: JSX.IntrinsicElements[\"div\"]) {\n  return (\n    <div\n      data-slot=\"item-content\"\n      class={cn(\n        \"flex flex-1 flex-col gap-1 group-data-[size=xs]/item:gap-0 [&+[data-slot=item-content]]:flex-none\",\n        className,\n      )}\n      {...props}\n    />\n  );\n}\n\nfunction ItemTitle({\n  class: className,\n  ...props\n}: JSX.IntrinsicElements[\"div\"]) {\n  return (\n    <div\n      data-slot=\"item-title\"\n      class={cn(\n        \"line-clamp-1 flex w-fit items-center gap-2 text-sm leading-snug font-medium underline-offset-4\",\n        className,\n      )}\n      {...props}\n    />\n  );\n}\n\nfunction ItemDescription({\n  class: className,\n  ...props\n}: JSX.IntrinsicElements[\"p\"]) {\n  return (\n    <p\n      data-slot=\"item-description\"\n      class={cn(\n        \"line-clamp-2 text-left text-sm leading-normal font-normal text-muted-foreground group-data-[size=xs]/item:text-xs [&>a]:underline [&>a]:underline-offset-4 [&>a:hover]:text-primary\",\n        className,\n      )}\n      {...props}\n    />\n  );\n}\n\nfunction ItemActions({\n  class: className,\n  ...props\n}: JSX.IntrinsicElements[\"div\"]) {\n  return (\n    <div\n      data-slot=\"item-actions\"\n      class={cn(\"flex items-center gap-2\", className)}\n      {...props}\n    />\n  );\n}\n\nfunction ItemHeader({\n  class: className,\n  ...props\n}: JSX.IntrinsicElements[\"div\"]) {\n  return (\n    <div\n      data-slot=\"item-header\"\n      class={cn(\n        \"flex basis-full items-center justify-between gap-2\",\n        className,\n      )}\n      {...props}\n    />\n  );\n}\n\nfunction ItemFooter({\n  class: className,\n  ...props\n}: JSX.IntrinsicElements[\"div\"]) {\n  return (\n    <div\n      data-slot=\"item-footer\"\n      class={cn(\n        \"flex basis-full items-center justify-between gap-2\",\n        className,\n      )}\n      {...props}\n    />\n  );\n}\n\nexport {\n  Item,\n  ItemActions,\n  ItemContent,\n  ItemDescription,\n  ItemFooter,\n  ItemGroup,\n  ItemHeader,\n  ItemMedia,\n  ItemSeparator,\n  ItemTitle,\n};\n"
    }
  ]
}
