{
  "$schema": "https://raw.githubusercontent.com/sinwanjs/sinwan-ui-registry/main/registry-item.schema.json",
  "name": "input-otp",
  "type": "registry:ui",
  "title": "Input OTP",
  "description": "One-time password input split into individual slots.",
  "dependencies": [
    "lucide@^0.544.0"
  ],
  "devDependencies": [],
  "registryDependencies": [
    "icons",
    "utils"
  ],
  "files": [
    {
      "path": "input-otp/index.ts",
      "type": "registry:ui",
      "content": "export {\n  InputOTP,\n  InputOTPGroup,\n  InputOTPSeparator,\n  InputOTPSlot,\n  type InputOTPSlotProps,\n} from \"./input-otp\";\nexport {\n  OTPInputContext,\n  useInputOtp,\n  useInputOtpRoot,\n  useInputOtpSlot,\n  type InputOTPProps,\n  type InputOtpRootReturn,\n  type InputOtpSlotReturn,\n  type OtpApi,\n  type OtpSlotState,\n} from \"./useInputOtp\";\n"
    },
    {
      "path": "input-otp/input-otp.tsx",
      "type": "registry:ui",
      "content": "import { cc } from \"sinwan/component\";\nimport { Show } from \"sinwan/control-flow\";\nimport { Minus } from \"lucide\";\n\nimport { Icon } from \"@/lib/icons\";\nimport { cn } from \"@/lib/utils\";\nimport {\n  useInputOtpRoot,\n  useInputOtpSlot,\n  type InputOTPProps,\n} from \"./useInputOtp\";\n\nexport const InputOTP = cc<InputOTPProps>((props) => {\n  const root = useInputOtpRoot(props);\n\n  return (\n    <div\n      data-slot=\"input-otp\"\n      class={cn(\n        \"cn-input-otp relative flex items-center has-disabled:opacity-50\",\n        props.containerClass,\n      )}\n      aria-invalid={props[\"aria-invalid\"]}\n    >\n      <input\n        ref={root.setInput}\n        data-slot=\"input-otp-hidden\"\n        class={cn(\n          \"absolute inset-0 h-full w-full cursor-default opacity-0 disabled:cursor-not-allowed\",\n          props.class,\n        )}\n        value={root.value.value}\n        maxLength={props.maxLength ?? 6}\n        disabled={props.disabled}\n        inputMode={props.inputMode ?? \"numeric\"}\n        autocomplete={props.autocomplete ?? \"one-time-code\"}\n        spellcheck={false}\n        aria-invalid={props[\"aria-invalid\"]}\n        onfocus={root.onFocus}\n        onblur={root.onBlur}\n        oninput={root.onInput}\n        onpaste={root.onPaste}\n      />\n      <div class=\"flex items-center\" onclick={root.onContainerClick}>\n        {props.children}\n      </div>\n    </div>\n  );\n});\n\nexport function InputOTPGroup({\n  class: className,\n  ...props\n}: JSX.IntrinsicElements[\"div\"]) {\n  return (\n    <div\n      data-slot=\"input-otp-group\"\n      class={cn(\n        \"flex items-center rounded-lg has-aria-invalid:border-destructive has-aria-invalid:ring-3 has-aria-invalid:ring-destructive/20 dark:has-aria-invalid:ring-destructive/40\",\n        className,\n      )}\n      {...props}\n    />\n  );\n}\n\nexport type InputOTPSlotProps = JSX.IntrinsicElements[\"div\"] & {\n  index: number;\n};\n\nexport const InputOTPSlot = cc<InputOTPSlotProps>(\n  ({ index, class: className, ...props }) => {\n    const slot = useInputOtpSlot(() => index);\n\n    return (\n      <div\n        data-slot=\"input-otp-slot\"\n        data-active={slot.isActive.value ? \"true\" : undefined}\n        class={cn(\n          \"relative flex size-8 items-center justify-center border-y border-r border-input text-sm transition-all outline-none first:rounded-l-lg first:border-l last:rounded-r-lg aria-invalid:border-destructive data-[active=true]:z-10 data-[active=true]:border-ring data-[active=true]:ring-3 data-[active=true]:ring-ring/50 data-[active=true]:aria-invalid:border-destructive data-[active=true]:aria-invalid:ring-destructive/20 dark:bg-input/30 dark:data-[active=true]:aria-invalid:ring-destructive/40\",\n          className,\n        )}\n        {...props}\n      >\n        {slot.char.value}\n        <Show when={slot.hasFakeCaret.value}>\n          <div class=\"pointer-events-none absolute inset-0 flex items-center justify-center\">\n            <div class=\"h-4 w-px animate-caret-blink bg-foreground duration-1000\" />\n          </div>\n        </Show>\n      </div>\n    );\n  },\n);\n\nexport function InputOTPSeparator(props: JSX.IntrinsicElements[\"div\"]) {\n  return (\n    <div\n      data-slot=\"input-otp-separator\"\n      class=\"flex items-center [&_svg:not([class*='size-'])]:size-4\"\n      role=\"separator\"\n      {...props}\n    >\n      <Icon icon={Minus} />\n    </div>\n  );\n}\n"
    },
    {
      "path": "input-otp/useInputOtp.ts",
      "type": "registry:ui",
      "content": "import {\n  getRawProps,\n  inject,\n  provide,\n  type InjectionKey,\n  type SinwanNode,\n} from \"sinwan/component\";\nimport {\n  computed,\n  signal,\n  unwrap,\n  type Computed,\n  type Signal,\n} from \"sinwan/reactivity\";\n\nexport type OtpSlotState = {\n  char: string;\n  hasFakeCaret: boolean;\n  isActive: boolean;\n};\n\nexport type OtpApi = {\n  value: Signal<string>;\n  maxLength: number;\n  slots: () => OtpSlotState[];\n  focus: () => void;\n};\n\nexport const OTPInputContext: InjectionKey<OtpApi> = Symbol(\"sinwan-ui.input-otp\");\n\nexport type InputOTPProps = {\n  maxLength?: number;\n  value?: string;\n  onChange?: (value: string) => void;\n  onComplete?: (value: string) => void;\n  class?: string;\n  containerClass?: string;\n  disabled?: boolean;\n  children?: SinwanNode;\n  pattern?: string;\n  inputMode?: JSX.IntrinsicElements[\"input\"][\"inputMode\"];\n  autocomplete?: string;\n  \"aria-invalid\"?: boolean | \"true\" | \"false\";\n};\n\nexport type InputOtpRootReturn = {\n  otp: OtpApi;\n  value: Signal<string>;\n  maxLength: number;\n  setInput: (element: HTMLInputElement | null) => void;\n  onFocus: () => void;\n  onBlur: () => void;\n  onInput: (event: Event) => void;\n  onPaste: (event: ClipboardEvent) => void;\n  onContainerClick: () => void;\n};\n\nexport type InputOtpSlotReturn = {\n  char: Computed<string>;\n  isActive: Computed<boolean>;\n  hasFakeCaret: Computed<boolean>;\n};\n\nfunction sanitize(value: string, maxLength: number, pattern?: string): string {\n  let next = value;\n  if (!pattern) {\n    next = value.replace(/\\s/g, \"\");\n    return next.slice(0, maxLength);\n  }\n  try {\n    const re = new RegExp(pattern, \"g\");\n    next = (next.match(re) ?? []).join(\"\");\n  } catch {\n    next = value.replace(/\\s/g, \"\");\n  }\n  return next.slice(0, maxLength);\n}\n\nexport function useInputOtpRoot(props: InputOTPProps): InputOtpRootReturn {\n  const value = signal(props.value ?? \"\");\n  if (props.value !== undefined) value.value = props.value;\n\n  let inputEl: HTMLInputElement | null = null;\n  const focused = signal(false);\n  const length = () => props.maxLength ?? 6;\n\n  const setValue = (next: string) => {\n    const maxLength = length();\n    const cleaned = sanitize(next, maxLength, props.pattern);\n    value.value = cleaned;\n    const raw = getRawProps(props);\n    const onChange = unwrap(raw.onChange);\n    const onComplete = unwrap(raw.onComplete);\n    if (typeof onChange === \"function\") onChange(cleaned);\n    if (cleaned.length >= maxLength && typeof onComplete === \"function\") {\n      onComplete(cleaned);\n    }\n  };\n\n  const slots = (): OtpSlotState[] => {\n    const maxLength = length();\n    const current = value.value;\n    const activeIndex = Math.min(current.length, maxLength - 1);\n    return Array.from({ length: maxLength }, (_, index) => ({\n      char: current[index] ?? \"\",\n      isActive: focused.value && index === activeIndex,\n      hasFakeCaret:\n        focused.value && index === activeIndex && current.length < maxLength\n          ? index === current.length\n          : focused.value &&\n            index === activeIndex &&\n            current.length === maxLength &&\n            index === maxLength - 1,\n    }));\n  };\n\n  const otp: OtpApi = {\n    value,\n    get maxLength() {\n      return length();\n    },\n    slots,\n    focus: () => inputEl?.focus(),\n  };\n  provide(OTPInputContext, otp);\n\n  return {\n    otp,\n    value,\n    get maxLength() {\n      return length();\n    },\n    setInput: (element) => {\n      inputEl = element;\n    },\n    onFocus: () => {\n      focused.value = true;\n    },\n    onBlur: () => {\n      focused.value = false;\n    },\n    onInput: (event) => {\n      const target = event.target as HTMLInputElement;\n      setValue(target.value);\n    },\n    onPaste: (event) => {\n      event.preventDefault();\n      const text = event.clipboardData?.getData(\"text\") ?? \"\";\n      setValue(text);\n    },\n    onContainerClick: () => {\n      if (!props.disabled) inputEl?.focus();\n    },\n  };\n}\n\nexport function useInputOtp(consumer = \"useInputOtp\"): OtpApi {\n  const otp = inject(OTPInputContext);\n  if (!otp) {\n    throw new Error(`${consumer} must be used within InputOTP`);\n  }\n  return otp;\n}\n\nexport function useInputOtpSlot(index: () => number): InputOtpSlotReturn {\n  const otp = useInputOtp(\"InputOTPSlot\");\n  const slot = computed(() => otp.slots()[index()]);\n  return {\n    char: computed(() => slot.value?.char ?? \"\"),\n    isActive: computed(() => Boolean(slot.value?.isActive)),\n    hasFakeCaret: computed(() => Boolean(slot.value?.hasFakeCaret)),\n  };\n}\n"
    }
  ]
}
