{
  "$schema": "https://raw.githubusercontent.com/sinwanjs/sinwan-ui-registry/main/registry-item.schema.json",
  "name": "input",
  "type": "registry:ui",
  "title": "Input",
  "description": "Text input styled for sinwan-ui forms.",
  "dependencies": [],
  "devDependencies": [],
  "registryDependencies": [
    "utils"
  ],
  "files": [
    {
      "path": "input.tsx",
      "type": "registry:ui",
      "content": "import { cn } from \"@/lib/utils\";\n\nexport function Input({\n  class: className,\n  type,\n  ...props\n}: JSX.IntrinsicElements[\"input\"]) {\n  return (\n    <input\n      type={type}\n      data-slot=\"input\"\n      class={cn(\n        \"h-8 w-full min-w-0 rounded-lg border border-input bg-transparent px-2.5 py-1 text-base transition-colors outline-none file:inline-flex file:h-6 file:border-0 file:bg-transparent file:text-sm file:font-medium file:text-foreground placeholder:text-muted-foreground focus-visible:border-ring focus-visible:ring-3 focus-visible:ring-ring/50 disabled:pointer-events-none disabled:cursor-not-allowed disabled:bg-input/50 disabled:opacity-50 aria-invalid:border-destructive aria-invalid:ring-3 aria-invalid:ring-destructive/20 md:text-sm dark:bg-card dark:disabled:bg-input/80 dark:aria-invalid:border-destructive/50 dark:aria-invalid:ring-destructive/40 dark:border-border\",\n        className,\n      )}\n      {...props}\n    />\n  );\n}\n"
    }
  ]
}
