{
  "$schema": "https://raw.githubusercontent.com/sinwanjs/sinwan-ui-registry/main/registry-item.schema.json",
  "name": "sheet",
  "type": "registry:ui",
  "title": "Sheet",
  "description": "Dialog that slides in from a side of the screen.",
  "dependencies": [
    "lucide@^0.544.0",
    "sinwan-ui-core@^1.0.0"
  ],
  "devDependencies": [],
  "registryDependencies": [
    "button",
    "icons",
    "utils"
  ],
  "files": [
    {
      "path": "sheet.tsx",
      "type": "registry:ui",
      "content": "import { cc, type SinwanNode } from \"sinwan/component\";\nimport { X } from \"lucide\";\n\nimport { Icon } from \"@/lib/icons\";\nimport { cn } from \"@/lib/utils\";\nimport {\n  DialogClose as DialogClosePrimitive,\n  DialogContent as DialogContentPrimitive,\n  DialogOverlay as DialogOverlayPrimitive,\n  DialogRoot,\n  DialogTrigger as DialogTriggerPrimitive,\n} from \"sinwan-ui-core/overlay\";\nimport { Button } from \"@/components/ui/button\";\n\ntype SheetProps = {\n  children?: SinwanNode;\n  open?: boolean;\n  defaultOpen?: boolean;\n  onOpenChange?: (open: boolean) => void;\n};\n\nfunction Sheet(props: SheetProps) {\n  return <DialogRoot {...props} />;\n}\n\ntype SheetTriggerProps = {\n  children?: SinwanNode;\n  class?: string;\n  asChild?: boolean;\n};\n\nfunction SheetTrigger(props: SheetTriggerProps) {\n  return <DialogTriggerPrimitive {...props} />;\n}\n\ntype SheetCloseProps = {\n  children?: SinwanNode;\n  class?: string;\n  asChild?: boolean;\n};\n\nfunction SheetClose(props: SheetCloseProps) {\n  return <DialogClosePrimitive {...props} />;\n}\n\ntype SheetOverlayProps = {\n  class?: string;\n};\n\nconst SheetOverlay = cc<SheetOverlayProps>(({ class: className }) => {\n  return (\n    <DialogOverlayPrimitive\n      class={cn(\n        \"fixed inset-0 z-50 bg-black/10 duration-200 supports-backdrop-filter:backdrop-blur-xs data-open:animate-in data-open:fade-in-0 data-closed:animate-out data-closed:fade-out-0 data-closed:!fill-mode-forwards\",\n        className,\n      )}\n    />\n  );\n});\n\ntype SheetContentProps = {\n  children?: SinwanNode;\n  class?: string;\n  side?: \"top\" | \"right\" | \"bottom\" | \"left\";\n  showCloseButton?: boolean;\n  overlayClass?: string;\n  style?: string | Record<string, string>;\n  dir?: string;\n  [key: `data-${string}`]: string | undefined;\n};\n\nconst SheetContent = cc<SheetContentProps>(({\n  class: className,\n  children,\n  side = \"right\",\n  showCloseButton = true,\n  overlayClass,\n  style,\n  dir,\n  ...rest\n}) => {\n  return (\n    <>\n      <SheetOverlay class={cn(\"fixed\", overlayClass)} />\n      <DialogContentPrimitive\n        data-slot=\"sheet-content\"\n        data-side={side}\n        class={cn(\n          \"fixed z-50 flex flex-col gap-4 bg-popover bg-clip-padding text-sm text-popover-foreground shadow-lg duration-200 data-[side=bottom]:inset-x-0 data-[side=bottom]:bottom-0 data-[side=bottom]:h-auto data-[side=bottom]:border-t data-[side=left]:inset-y-0 data-[side=left]:left-0 data-[side=left]:h-full data-[side=left]:w-3/4 data-[side=left]:border-r data-[side=right]:inset-y-0 data-[side=right]:right-0 data-[side=right]:h-full data-[side=right]:w-3/4 data-[side=right]:border-l data-[side=top]:inset-x-0 data-[side=top]:top-0 data-[side=top]:h-auto data-[side=top]:border-b data-[side=left]:sm:max-w-md data-[side=right]:sm:max-w-md data-open:animate-in data-open:fade-in-0 data-[side=bottom]:data-open:slide-in-from-bottom-10 data-[side=left]:data-open:slide-in-from-left-10 data-[side=right]:data-open:slide-in-from-right-10 data-[side=top]:data-open:slide-in-from-top-10 data-closed:animate-out data-closed:fade-out-0 data-closed:!fill-mode-forwards data-[side=bottom]:data-closed:slide-out-to-bottom-10 data-[side=left]:data-closed:slide-out-to-left-10 data-[side=right]:data-closed:slide-out-to-right-10 data-[side=top]:data-closed:slide-out-to-top-10\",\n          className,\n        )}\n        {...rest}\n      >\n        <div dir={dir} style={style} class=\"contents\">\n          {children}\n        </div>\n        {showCloseButton ? (\n          <DialogClosePrimitive asChild>\n            <Button\n              variant=\"ghost\"\n              class=\"absolute top-3 right-3\"\n              size=\"icon-sm\"\n            >\n              <Icon icon={X} />\n              <span class=\"sr-only\">Close</span>\n            </Button>\n          </DialogClosePrimitive>\n        ) : null}\n      </DialogContentPrimitive>\n    </>\n  );\n});\n\ntype DivProps = {\n  children?: SinwanNode;\n  class?: string;\n};\n\nfunction SheetHeader({ class: className, ...props }: DivProps) {\n  return (\n    <div\n      data-slot=\"sheet-header\"\n      class={cn(\"flex flex-col gap-0.5 p-4\", className)}\n      {...props}\n    />\n  );\n}\n\nfunction SheetFooter({ class: className, ...props }: DivProps) {\n  return (\n    <div\n      data-slot=\"sheet-footer\"\n      class={cn(\"mt-auto flex flex-col gap-2 p-4\", className)}\n      {...props}\n    />\n  );\n}\n\nfunction SheetTitle({ class: className, children, ...props }: DivProps) {\n  return (\n    <h2\n      data-slot=\"sheet-title\"\n      class={cn(\n        \"font-heading text-base font-medium text-foreground\",\n        className,\n      )}\n      {...props}\n    >\n      {children}\n    </h2>\n  );\n}\n\nfunction SheetDescription({ class: className, children, ...props }: DivProps) {\n  return (\n    <p\n      data-slot=\"sheet-description\"\n      class={cn(\"text-sm text-muted-foreground\", className)}\n      {...props}\n    >\n      {children}\n    </p>\n  );\n}\n\nexport {\n  Sheet,\n  SheetClose,\n  SheetContent,\n  SheetDescription,\n  SheetFooter,\n  SheetHeader,\n  SheetTitle,\n  SheetTrigger,\n};\n"
    }
  ]
}
