{
  "$schema": "https://raw.githubusercontent.com/sinwanjs/sinwan-ui-registry/main/registry-item.schema.json",
  "name": "avatar",
  "type": "registry:ui",
  "title": "Avatar",
  "description": "User image with a fallback shown while loading or on error.",
  "dependencies": [],
  "devDependencies": [],
  "registryDependencies": [
    "utils"
  ],
  "files": [
    {
      "path": "avatar/avatar.tsx",
      "type": "registry:ui",
      "content": "import { cc, type SinwanComponent, type SinwanNode } from \"sinwan/component\";\nimport { Show } from \"sinwan/control-flow\";\n\nimport { cn } from \"@/lib/utils\";\nimport {\n  useAvatarFallback,\n  useAvatarImage,\n  useAvatarRoot,\n  type AvatarImageProps,\n} from \"./useAvatar\";\n\nexport type AvatarProps = JSX.IntrinsicElements[\"div\"] & {\n  size?: \"default\" | \"sm\" | \"lg\";\n  children?: SinwanNode;\n};\n\nconst Avatar: SinwanComponent<AvatarProps> = cc(\n  ({ class: className, size = \"default\", children, ...props }) => {\n    useAvatarRoot();\n\n    return (\n      <div\n        data-slot=\"avatar\"\n        data-size={size}\n        class={cn(\n          \"group/avatar relative flex size-8 shrink-0 rounded-full select-none after:pointer-events-none after:absolute after:inset-0 after:rounded-full after:border after:border-border after:mix-blend-darken data-[size=lg]:size-10 data-[size=sm]:size-6 dark:after:mix-blend-lighten\",\n          className,\n        )}\n        {...props}\n      >\n        {children}\n      </div>\n    );\n  },\n);\n\nconst AvatarImage: SinwanComponent<AvatarImageProps> = cc((props) => {\n  const image = useAvatarImage(props);\n\n  return (\n    <Show when={image.visible.value}>\n      <img\n        data-slot=\"avatar-image\"\n        {...props}\n        class={cn(\n          \"absolute inset-0 aspect-square size-full overflow-hidden rounded-full object-cover\",\n          props.class,\n          image.loaded.value ? undefined : \"opacity-0\",\n        )}\n        onload={image.onLoad}\n        onerror={image.onError}\n      />\n    </Show>\n  );\n});\n\nexport type AvatarFallbackProps = JSX.IntrinsicElements[\"span\"] & {\n  children?: SinwanNode;\n};\n\nconst AvatarFallback: SinwanComponent<AvatarFallbackProps> = cc(\n  ({ class: className, children, ...props }) => {\n    const fallback = useAvatarFallback();\n\n    return (\n      <Show when={fallback.visible.value}>\n        <span\n          data-slot=\"avatar-fallback\"\n          class={cn(\n            \"absolute inset-0 flex size-full items-center justify-center overflow-hidden rounded-full bg-muted text-sm text-muted-foreground group-data-[size=sm]/avatar:text-xs\",\n            className,\n          )}\n          {...props}\n        >\n          {children}\n        </span>\n      </Show>\n    );\n  },\n);\n\nexport type AvatarBadgeProps = JSX.IntrinsicElements[\"span\"];\n\nfunction AvatarBadge({\n  class: className,\n  ...props\n}: AvatarBadgeProps) {\n  return (\n    <span\n      data-slot=\"avatar-badge\"\n      class={cn(\n        \"absolute right-0 bottom-0 z-10 inline-flex items-center justify-center rounded-full bg-primary text-primary-foreground bg-blend-color ring-2 ring-background select-none\",\n        \"group-data-[size=sm]/avatar:size-2 group-data-[size=sm]/avatar:[&>svg]:hidden\",\n        \"group-data-[size=default]/avatar:size-2.5 group-data-[size=default]/avatar:[&>svg]:size-2\",\n        \"group-data-[size=lg]/avatar:size-3 group-data-[size=lg]/avatar:[&>svg]:size-2\",\n        className,\n      )}\n      {...props}\n    />\n  );\n}\n\nexport type AvatarGroupProps = JSX.IntrinsicElements[\"div\"];\n\nfunction AvatarGroup({\n  class: className,\n  ...props\n}: AvatarGroupProps) {\n  return (\n    <div\n      data-slot=\"avatar-group\"\n      class={cn(\n        \"group/avatar-group flex -space-x-2 *:data-[slot=avatar]:ring-2 *:data-[slot=avatar]:ring-background\",\n        className,\n      )}\n      {...props}\n    />\n  );\n}\n\nexport type AvatarGroupCountProps = JSX.IntrinsicElements[\"div\"];\n\nfunction AvatarGroupCount({\n  class: className,\n  ...props\n}: AvatarGroupCountProps) {\n  return (\n    <div\n      data-slot=\"avatar-group-count\"\n      class={cn(\n        \"relative flex size-8 shrink-0 items-center justify-center rounded-full bg-muted text-sm text-muted-foreground ring-2 ring-background group-has-data-[size=lg]/avatar-group:size-10 group-has-data-[size=sm]/avatar-group:size-6 [&>svg]:size-4 group-has-data-[size=lg]/avatar-group:[&>svg]:size-5 group-has-data-[size=sm]/avatar-group:[&>svg]:size-3\",\n        className,\n      )}\n      {...props}\n    />\n  );\n}\n\nexport {\n  Avatar,\n  AvatarBadge,\n  AvatarFallback,\n  AvatarGroup,\n  AvatarGroupCount,\n  AvatarImage,\n};\n"
    },
    {
      "path": "avatar/index.ts",
      "type": "registry:ui",
      "content": "export {\n  Avatar,\n  AvatarBadge,\n  AvatarFallback,\n  AvatarGroup,\n  AvatarGroupCount,\n  AvatarImage,\n  type AvatarBadgeProps,\n  type AvatarFallbackProps,\n  type AvatarGroupCountProps,\n  type AvatarGroupProps,\n  type AvatarProps,\n} from \"./avatar\";\nexport {\n  useAvatar,\n  useAvatarFallback,\n  useAvatarImage,\n  useAvatarRoot,\n  type AvatarContext,\n  type AvatarFallbackReturn,\n  type AvatarImageOptions,\n  type AvatarImageProps,\n  type AvatarImageReturn,\n} from \"./useAvatar\";\n"
    },
    {
      "path": "avatar/useAvatar.ts",
      "type": "registry:ui",
      "content": "import { getRawProps, inject, provide, type InjectionKey } from \"sinwan/component\";\nimport {\n  computed,\n  signal,\n  unwrap,\n  type Computed,\n  type Signal,\n} from \"sinwan/reactivity\";\n\nexport type AvatarContext = {\n  loaded: Signal<boolean>;\n  failed: Signal<boolean>;\n};\n\nexport type AvatarImageProps = JSX.IntrinsicElements[\"img\"];\n\ntype AvatarImageLoadEvent = Parameters<NonNullable<AvatarImageProps[\"onload\"]>>[0];\ntype AvatarImageErrorEvent = Parameters<NonNullable<AvatarImageProps[\"onerror\"]>>[0];\n\nexport type AvatarImageOptions = Pick<AvatarImageProps, \"onload\" | \"onerror\">;\n\nexport type AvatarImageReturn = {\n  visible: Computed<boolean>;\n  loaded: Signal<boolean>;\n  onLoad: (event: AvatarImageLoadEvent) => void;\n  onError: (event: AvatarImageErrorEvent) => void;\n};\n\nexport type AvatarFallbackReturn = {\n  visible: Computed<boolean>;\n};\n\nconst AvatarKey: InjectionKey<AvatarContext> = Symbol(\"sinwan-ui.avatar\");\n\nexport function useAvatarRoot(): AvatarContext {\n  const avatar: AvatarContext = {\n    loaded: signal(false),\n    failed: signal(false),\n  };\n  provide(AvatarKey, avatar);\n  return avatar;\n}\n\nexport function useAvatar(consumer = \"useAvatar\"): AvatarContext {\n  const context = inject(AvatarKey);\n  if (!context) {\n    throw new Error(`${consumer} must be used within a <Avatar />`);\n  }\n  return context;\n}\n\nexport function useAvatarImage(props: AvatarImageOptions): AvatarImageReturn {\n  const avatar = useAvatar(\"AvatarImage\");\n\n  return {\n    visible: computed(() => !avatar.failed.value),\n    loaded: avatar.loaded,\n    onLoad: (event) => {\n      avatar.loaded.value = true;\n      avatar.failed.value = false;\n      const onload = unwrap(getRawProps(props).onload);\n      if (typeof onload === \"function\") onload(event);\n    },\n    onError: (event) => {\n      avatar.failed.value = true;\n      avatar.loaded.value = false;\n      const onerror = unwrap(getRawProps(props).onerror);\n      if (typeof onerror === \"function\") onerror(event);\n    },\n  };\n}\n\nexport function useAvatarFallback(): AvatarFallbackReturn {\n  const avatar = useAvatar(\"AvatarFallback\");\n\n  return {\n    visible: computed(() => avatar.failed.value || !avatar.loaded.value),\n  };\n}\n"
    }
  ]
}
