{
  "$schema": "https://raw.githubusercontent.com/sinwanjs/sinwan-ui-registry/main/registry-item.schema.json",
  "name": "tabs",
  "type": "registry:ui",
  "title": "Tabs",
  "description": "Tabbed panels with line and vertical variants.",
  "dependencies": [
    "class-variance-authority@^0.7.1",
    "sinwan-ui-core@^1.1.0"
  ],
  "devDependencies": [],
  "registryDependencies": [
    "utils"
  ],
  "files": [
    {
      "path": "tabs.tsx",
      "type": "registry:ui",
      "content": "import { getRawProps, type SinwanNode } from \"sinwan/component\";\nimport { cva, type VariantProps } from \"class-variance-authority\";\n\nimport { cn } from \"@/lib/utils\";\nimport {\n  TabsContent as TabsContentPrimitive,\n  TabsList as TabsListPrimitive,\n  TabsRoot,\n  TabsTrigger as TabsTriggerPrimitive,\n} from \"sinwan-ui-core/controls\";\n\ntype TabsProps = {\n  children?: SinwanNode;\n  value?: string;\n  defaultValue?: string;\n  onValueChange?: (v: string) => void;\n  class?: string;\n  orientation?: \"horizontal\" | \"vertical\";\n};\n\nfunction Tabs(props: TabsProps) {\n  const {\n    class: className,\n    orientation = \"horizontal\",\n    ...rest\n  } = getRawProps(props);\n  return (\n    <TabsRoot\n      orientation={orientation}\n      class={cn(\n        \"group/tabs flex gap-2 data-horizontal:flex-col data-vertical:flex-row\",\n        orientation === \"horizontal\" && \"flex-col\",\n        orientation === \"vertical\" && \"flex-row\",\n        className,\n      )}\n      {...rest}\n    />\n  );\n}\n\nconst tabsListVariants = cva(\n  \"group/tabs-list inline-flex w-fit items-center justify-center rounded-lg p-[3px] text-muted-foreground group-data-horizontal/tabs:h-8 group-data-vertical/tabs:h-fit group-data-vertical/tabs:flex-col data-[variant=line]:rounded-none\",\n  {\n    variants: {\n      variant: {\n        default: \"bg-muted\",\n        line: \"gap-1 bg-transparent\",\n      },\n    },\n    defaultVariants: {\n      variant: \"default\",\n    },\n  },\n);\n\ntype TabsListProps = {\n  children?: SinwanNode;\n  class?: string;\n  variant?: VariantProps<typeof tabsListVariants>[\"variant\"];\n};\n\nfunction TabsList({\n  class: className,\n  variant = \"default\",\n  ...props\n}: TabsListProps) {\n  return (\n    <TabsListPrimitive\n      data-variant={variant ?? undefined}\n      class={cn(tabsListVariants({ variant }), className)}\n      {...props}\n    />\n  );\n}\n\ntype TabsTriggerProps = {\n  children?: SinwanNode;\n  class?: string;\n  value: string;\n  disabled?: boolean;\n};\n\nfunction TabsTrigger({ class: className, ...props }: TabsTriggerProps) {\n  return (\n    <TabsTriggerPrimitive\n      class={cn(\n        \"relative inline-flex h-[calc(100%-1px)] flex-1 items-center justify-center gap-1.5 rounded-md border border-transparent px-1.5 py-0.5 text-sm font-medium whitespace-nowrap text-foreground/60 transition-all group-data-vertical/tabs:w-full group-data-vertical/tabs:justify-start hover:text-foreground focus-visible:border-ring focus-visible:ring-[3px] focus-visible:ring-ring/50 focus-visible:outline-1 focus-visible:outline-ring disabled:pointer-events-none disabled:opacity-50 has-data-[icon=inline-end]:pr-1 has-data-[icon=inline-start]:pl-1 dark:text-muted-foreground dark:hover:text-foreground group-data-[variant=default]/tabs-list:data-active:shadow-sm group-data-[variant=line]/tabs-list:data-active:shadow-none [&_svg]:pointer-events-none [&_svg]:shrink-0 [&_svg:not([class*='size-'])]:size-4\",\n        \"group-data-[variant=line]/tabs-list:bg-transparent group-data-[variant=line]/tabs-list:data-active:bg-transparent dark:group-data-[variant=line]/tabs-list:data-active:border-transparent dark:group-data-[variant=line]/tabs-list:data-active:bg-transparent\",\n        \"data-active:bg-background data-active:text-foreground dark:data-active:border-input dark:data-active:bg-card dark:data-active:text-foreground\",\n        \"after:pointer-events-none after:absolute after:bg-foreground after:opacity-0 after:transition-opacity after:content-[''] group-data-horizontal/tabs:after:inset-x-0 group-data-horizontal/tabs:after:bottom-[-5px] group-data-horizontal/tabs:after:h-0.5 group-data-vertical/tabs:after:inset-y-0 group-data-vertical/tabs:after:-right-1 group-data-vertical/tabs:after:w-0.5 group-data-[variant=line]/tabs-list:data-active:after:opacity-100\",\n        className,\n      )}\n      {...props}\n    />\n  );\n}\n\ntype TabsContentProps = {\n  children?: SinwanNode;\n  class?: string;\n  value: string;\n};\n\nfunction TabsContent({ class: className, ...props }: TabsContentProps) {\n  return (\n    <TabsContentPrimitive\n      class={cn(\"flex-1 text-sm outline-none\", className)}\n      {...props}\n    />\n  );\n}\n\nexport { Tabs, TabsContent, TabsList, TabsTrigger, tabsListVariants };\n"
    }
  ]
}
