{
  "$schema": "https://raw.githubusercontent.com/sinwanjs/sinwan-ui-registry/main/registry-item.schema.json",
  "name": "dialog",
  "type": "registry:ui",
  "title": "Dialog",
  "description": "Modal window rendered in a portal with focus management.",
  "dependencies": [
    "lucide@^0.544.0",
    "sinwan-ui-core@^1.1.0"
  ],
  "devDependencies": [],
  "registryDependencies": [
    "button",
    "icons",
    "utils"
  ],
  "files": [
    {
      "path": "dialog.tsx",
      "type": "registry:ui",
      "content": "import type { SinwanNode } from \"sinwan/component\";\nimport { X } from \"lucide\";\n\nimport { Icon } from \"@/lib/icons\";\nimport { cn } from \"@/lib/utils\";\nimport {\n  DialogClose as DialogClosePrimitive,\n  DialogContent as DialogContentPrimitive,\n  DialogOverlay as DialogOverlayPrimitive,\n  DialogRoot,\n  DialogTrigger as DialogTriggerPrimitive,\n} from \"sinwan-ui-core/overlay\";\nimport { UiPortal } from \"sinwan-ui-core/core\";\nimport { Button } from \"@/components/ui/button\";\n\ntype DialogProps = {\n  children?: SinwanNode;\n  open?: boolean;\n  defaultOpen?: boolean;\n  onOpenChange?: (open: boolean) => void;\n};\n\nfunction Dialog(props: DialogProps) {\n  return <DialogRoot {...props} />;\n}\n\ntype DialogTriggerProps = {\n  children?: SinwanNode;\n  class?: string;\n  asChild?: boolean;\n};\n\nfunction DialogTrigger(props: DialogTriggerProps) {\n  return <DialogTriggerPrimitive {...props} />;\n}\n\ntype DialogPortalProps = {\n  children?: SinwanNode;\n};\n\nfunction DialogPortal({ children }: DialogPortalProps) {\n  return <UiPortal>{children}</UiPortal>;\n}\n\ntype DialogCloseProps = {\n  children?: SinwanNode;\n  class?: string;\n  asChild?: boolean;\n};\n\nfunction DialogClose(props: DialogCloseProps) {\n  return <DialogClosePrimitive {...props} />;\n}\n\ntype DialogOverlayProps = {\n  class?: string;\n};\n\nfunction DialogOverlay({ class: className }: DialogOverlayProps) {\n  return (\n    <DialogOverlayPrimitive\n      class={cn(\n        \"fixed inset-0 isolate z-50 bg-black/10 duration-200 supports-backdrop-filter:backdrop-blur-xs data-open:animate-in data-open:fade-in-0 data-closed:animate-out data-closed:fade-out-0 data-closed:!fill-mode-forwards\",\n        className,\n      )}\n    />\n  );\n}\n\ntype DialogContentProps = {\n  children?: SinwanNode;\n  class?: string;\n  showCloseButton?: boolean;\n};\n\nfunction DialogContent({\n  class: className,\n  children,\n  showCloseButton = true,\n}: DialogContentProps) {\n  return (\n    <>\n      <DialogOverlay />\n      <DialogContentPrimitive\n        class={cn(\n          \"fixed top-1/2 left-1/2 z-50 grid w-full max-w-[calc(100%-2rem)] -translate-x-1/2 -translate-y-1/2 gap-4 bg-background rounded-xl p-4 text-sm text-popover-foreground ring-1 ring-foreground/10 duration-200 outline-none sm:max-w-sm data-open:animate-in data-open:fade-in-0 data-open:zoom-in-95 data-closed:animate-out data-closed:fade-out-0 data-closed:zoom-out-95 data-closed:!fill-mode-forwards\",\n          className,\n        )}\n      >\n        {children}\n        {showCloseButton ? (\n          <DialogClosePrimitive asChild>\n            <Button variant=\"ghost\" class=\"absolute top-2 right-2\" size=\"icon-sm\">\n              <Icon icon={X} />\n              <span class=\"sr-only\">Close</span>\n            </Button>\n          </DialogClosePrimitive>\n        ) : null}\n      </DialogContentPrimitive>\n    </>\n  );\n}\n\ntype DivProps = {\n  children?: SinwanNode;\n  class?: string;\n};\n\nfunction DialogHeader({ class: className, ...props }: DivProps) {\n  return (\n    <div\n      data-slot=\"dialog-header\"\n      class={cn(\"flex flex-col gap-2\", className)}\n      {...props}\n    />\n  );\n}\n\ntype DialogFooterProps = DivProps & {\n  showCloseButton?: boolean;\n};\n\nfunction DialogFooter({\n  class: className,\n  showCloseButton = false,\n  children,\n  ...props\n}: DialogFooterProps) {\n  return (\n    <div\n      data-slot=\"dialog-footer\"\n      class={cn(\n        \"-mx-4 -mb-4 flex flex-col-reverse gap-2 rounded-b-xl border-t bg-muted/50 p-4 sm:flex-row sm:justify-end\",\n        className,\n      )}\n      {...props}\n    >\n      {children}\n      {showCloseButton ? (\n        <DialogClosePrimitive asChild>\n          <Button variant=\"outline\">Close</Button>\n        </DialogClosePrimitive>\n      ) : null}\n    </div>\n  );\n}\n\nfunction DialogTitle({ class: className, children, ...props }: DivProps) {\n  return (\n    <h2\n      data-slot=\"dialog-title\"\n      class={cn(\n        \"font-heading text-base leading-none font-medium\",\n        className,\n      )}\n      {...props}\n    >\n      {children}\n    </h2>\n  );\n}\n\nfunction DialogDescription({ class: className, children, ...props }: DivProps) {\n  return (\n    <p\n      data-slot=\"dialog-description\"\n      class={cn(\n        \"text-sm text-muted-foreground *:[a]:underline *:[a]:underline-offset-3 *:[a]:hover:text-foreground\",\n        className,\n      )}\n      {...props}\n    >\n      {children}\n    </p>\n  );\n}\n\nexport {\n  Dialog,\n  DialogClose,\n  DialogContent,\n  DialogDescription,\n  DialogFooter,\n  DialogHeader,\n  DialogOverlay,\n  DialogPortal,\n  DialogTitle,\n  DialogTrigger,\n};\n"
    }
  ]
}
